{
  "schemaVersion": "yawn.source-bound-yawnbot.v0.1",
  "modelId": "model:dave:kickstarter:nestheads",
  "coordinate": "dave/kickstarter/nestheads",
  "revision": 1,
  "principalRef": "principal:dave",
  "relationshipRef": "relationship:dave:nestheads-kickstarter-backers",
  "arenaRef": "arena:nestheads-kickstarter-accountability",
  "subject": {
    "kind": "project",
    "label": "Nestheads Kickstarter relationship",
    "description": "A source-bound working model for accounting to the people who supported an unfinished Nestheads campaign and determining what can honestly happen next.",
    "sourceRefs": [
      "source:conversation:2026-09-01-kickstarter",
      "source:dave-private:nestheads-corpus-audit"
    ]
  },
  "lifecycleState": "candidate",
  "runtimeBinding": {
    "status": "candidate",
    "role": "mental_model_steward",
    "agentRef": null,
    "questionRefs": [
      "question:dave:kickstarter:what-is-owed",
      "question:dave:kickstarter:context-without-absolution",
      "question:dave:kickstarter:provable-deliverable"
    ],
    "authorityGrantRefs": [],
    "activationReceiptRefs": [],
    "scope": "Maintain a revisable model and propose questions or drafts; do not send, publish, promise delivery, spend, contact backers, or claim proof.",
    "stopOrRetireConditions": [
      "Dave rejects the framing or asks that the model be removed.",
      "The model cannot preserve source, consent, or attribution boundaries.",
      "A simpler source-linked record demonstrably serves the relationship with less burden."
    ]
  },
  "sourceRecords": [
    {
      "sourceId": "source:conversation:2026-09-01-kickstarter",
      "sourceKind": "transcript",
      "assertedBy": "principal:dave",
      "capturedBy": "agent:openai:gpt-5.6-pro",
      "locator": "Private conversation on 2026-09-01; exact platform message identifiers and bytes are not embedded in this public fixture.",
      "contentSha256": null,
      "integrityStatus": "unverified_reference",
      "exactTextAvailable": false,
      "visibility": "private",
      "status": "reference_only",
      "capturedAt": "2026-09-02T00:30:00Z",
      "notes": [
        "Reported shame, context, accountability intent, and desire to communicate remain attributable to Dave rather than independently verified history."
      ]
    },
    {
      "sourceId": "source:dave-private:nestheads-corpus-audit",
      "sourceKind": "repository_record",
      "assertedBy": "agent:anthropic:claude-code",
      "capturedBy": "agent:openai:gpt-5.6-pro",
      "locator": "dave.yawn-private/Yawns/corpus-mining-2026-08-18/ARENA_ENRICHMENTS_2026_08_18.yawn",
      "contentSha256": null,
      "integrityStatus": "unverified_reference",
      "exactTextAvailable": false,
      "visibility": "private",
      "status": "reference_only",
      "capturedAt": "2026-09-02T00:30:00Z",
      "notes": [
        "The audit identifies stable Nestheads themes and origin-history lacunae; it is not proof of every underlying event."
      ]
    },
    {
      "sourceId": "source:yawn-bot:nestheads-assets",
      "sourceKind": "repository_record",
      "assertedBy": "repository:yawn-ai/yawn.bot",
      "capturedBy": "agent:openai:gpt-5.6-pro",
      "locator": "yawn-ai/yawn.bot/public/nestheads",
      "contentSha256": null,
      "integrityStatus": "unverified_reference",
      "exactTextAvailable": false,
      "visibility": "public",
      "status": "reference_only",
      "capturedAt": "2026-09-02T00:30:00Z",
      "notes": [
        "Existing characters and world art are candidate View material, not runtime Agents or publication authorization."
      ]
    }
  ],
  "compilerProposals": [
    {
      "proposalId": "proposal:question:what-is-owed",
      "kind": "question",
      "text": "What does Dave owe the Nestheads Kickstarter backers now?",
      "proposedBy": "agent:openai:gpt-5.6-pro",
      "targetRef": "model:dave:kickstarter:nestheads",
      "compiledRecordRef": "question:dave:kickstarter:what-is-owed",
      "epistemicStatus": "inferred",
      "confidence": 0.92,
      "sourceRefs": ["source:conversation:2026-09-01-kickstarter"],
      "alternatives": [
        "What relationship is Dave trying to repair or continue?",
        "What commitment remains unresolved?"
      ],
      "status": "proposed",
      "dispositionEventRef": null,
      "correctionOperators": ["confirm", "reject", "correct", "add_more", "defer", "inspect_sources"]
    },
    {
      "proposalId": "proposal:value:accountability",
      "kind": "value",
      "text": "Context should remain visible without erasing responsibility.",
      "proposedBy": "agent:openai:gpt-5.6-pro",
      "targetRef": "model:dave:kickstarter:nestheads",
      "compiledRecordRef": "facet:value:accountability",
      "epistemicStatus": "inferred",
      "confidence": 0.88,
      "sourceRefs": ["source:conversation:2026-09-01-kickstarter"],
      "alternatives": [
        "Dave may prioritize reconnection, explanation, completion, restitution, or closure differently after review."
      ],
      "status": "proposed",
      "dispositionEventRef": null,
      "correctionOperators": ["confirm", "reject", "correct", "add_more", "defer", "inspect_sources"]
    },
    {
      "proposalId": "proposal:lacuna:original-promise",
      "kind": "lacuna",
      "text": "The exact original promise, fulfillment record, current expectations, and provable deliverable have not yet been reconstructed in this model.",
      "proposedBy": "agent:openai:gpt-5.6-pro",
      "targetRef": "model:dave:kickstarter:nestheads",
      "compiledRecordRef": "facet:lacuna:original-promise",
      "epistemicStatus": "unknown",
      "confidence": 0.98,
      "sourceRefs": [
        "source:conversation:2026-09-01-kickstarter",
        "source:dave-private:nestheads-corpus-audit"
      ],
      "alternatives": [],
      "status": "proposed",
      "dispositionEventRef": null,
      "correctionOperators": ["confirm", "reject", "correct", "add_more", "defer", "inspect_sources"]
    },
    {
      "proposalId": "proposal:expression:founder-update",
      "kind": "expression_provision",
      "text": "Provision a founder update that distinguishes apology, context, responsibility, current stance, unresolved claims, and a bounded next step.",
      "proposedBy": "agent:openai:gpt-5.6-pro",
      "targetRef": "model:dave:kickstarter:nestheads",
      "compiledRecordRef": "provision:founder-update:backers",
      "epistemicStatus": "inferred",
      "confidence": 0.84,
      "sourceRefs": ["source:conversation:2026-09-01-kickstarter"],
      "alternatives": [
        "Send a shorter status-first note before sharing the full model.",
        "Invite a small backer review group before a broad update.",
        "Hold communication until the campaign record is reconstructed."
      ],
      "status": "proposed",
      "dispositionEventRef": null,
      "correctionOperators": ["confirm", "reject", "correct", "add_more", "defer", "inspect_sources"]
    }
  ],
  "modelFacets": [
    {
      "facetId": "facet:emotion:shame",
      "ontologyRole": "proposal_facet",
      "facetKind": "emotion",
      "text": "Dave reports shame when reflecting on this unfinished relationship.",
      "assertedBy": "principal:dave",
      "epistemicStatus": "reported",
      "confidence": 0.96,
      "sourceRefs": ["source:conversation:2026-09-01-kickstarter"],
      "derivedFromRefs": [],
      "status": "proposed",
      "ratificationEventRef": null
    },
    {
      "facetId": "facet:value:accountability",
      "ontologyRole": "proposal_facet",
      "facetKind": "value",
      "text": "An accountable explanation should preserve context while keeping responsibility and unresolved obligations visible.",
      "assertedBy": "agent:openai:gpt-5.6-pro",
      "epistemicStatus": "inferred",
      "confidence": 0.88,
      "sourceRefs": ["source:conversation:2026-09-01-kickstarter"],
      "derivedFromRefs": ["proposal:value:accountability"],
      "status": "proposed",
      "ratificationEventRef": null
    },
    {
      "facetId": "facet:assumption:resolution-helps",
      "ontologyRole": "proposal_facet",
      "facetKind": "assumption",
      "text": "Backers may benefit from an optional source-linked model rather than a context-free status alone.",
      "assertedBy": "agent:openai:gpt-5.6-pro",
      "epistemicStatus": "assumed",
      "confidence": 0.62,
      "sourceRefs": ["source:conversation:2026-09-01-kickstarter"],
      "derivedFromRefs": [],
      "status": "proposed",
      "ratificationEventRef": null
    },
    {
      "facetId": "facet:lacuna:original-promise",
      "ontologyRole": "proposal_facet",
      "facetKind": "lacuna",
      "text": "The original promise, fulfillment record, current expectations, and provable present deliverable remain incompletely reconstructed.",
      "assertedBy": "agent:openai:gpt-5.6-pro",
      "epistemicStatus": "unknown",
      "confidence": 0.98,
      "sourceRefs": [
        "source:conversation:2026-09-01-kickstarter",
        "source:dave-private:nestheads-corpus-audit"
      ],
      "derivedFromRefs": ["proposal:lacuna:original-promise"],
      "status": "proposed",
      "ratificationEventRef": null
    }
  ],
  "characterViews": [
    {
      "characterViewId": "character-view:nestheads:context-model",
      "label": "Nestheads context characters",
      "viewKind": "game",
      "representsRefs": [
        "facet:emotion:shame",
        "facet:value:accountability",
        "facet:assumption:resolution-helps",
        "facet:lacuna:original-promise"
      ],
      "assetRefs": [
        "asset:yawn-bot:nestheads:characters",
        "asset:yawn-bot:nestheads:cognition"
      ],
      "sourceRefs": [
        "source:conversation:2026-09-01-kickstarter",
        "source:yawn-bot:nestheads-assets"
      ],
      "status": "proposed",
      "agentRef": null,
      "canonicalState": false
    }
  ],
  "questions": [
    {